Date Added;Traveler;Rosetta Project;DGS Report;Imagesets In Rosetta;Imagesets in IDX;Imagesets in Both;Imagesets No Workflows;Count
2020-08-28 20:53:36;[18-1797|http://rosettaprod-app01.a.fsglobal.net:8081/teamworks/source?project=18-1797];Alaska, State Archives (Juneau), Military Service Discharge Records, 1898-1934 - FSI;[Report|18-1797 DgsMisassignments];0;2;0;0;2
2020-08-28 20:53:37;[18-1313|http://rosettaprod-app01.a.fsglobal.net:8081/teamworks/source?project=18-1313];Pennsylvania, Register of Military Volunteers, 1861-1865 - FSI;[Report|18-1313 DgsMisassignments];0;15;0;0;15
2020-08-28 20:53:38;[18-0227|http://rosettaprod-app01.a.fsglobal.net:8081/teamworks/source?project=18-0227];Georgia, Atlanta History Center, Atlanta, Census of White and Colored Citizens, 1885-1888 - FSI;[Report|18-0227 DgsMisassignments];0;1;0;0;1
2020-08-28 20:53:41;[18-1558|http://rosettaprod-app01.a.fsglobal.net:8081/teamworks/source?project=18-1558];Utah, World War I Army Servicemen Records Abstracts, 1914-1918 - FSI;[Report|18-1558 DgsMisassignments];0;10;0;0;10
2020-08-28 20:53:43;[18-0226|http://rosettaprod-app01.a.fsglobal.net:8081/teamworks/source?project=18-0226];Georgia, Atlanta History Center, Atlanta, City Census Index, 1890 - FSI;[Report|18-0226 DgsMisassignments];0;1;0;0;1
2020-08-28 20:53:44;[18-1799|http://rosettaprod-app01.a.fsglobal.net:8081/teamworks/source?project=18-1799];Pennsylvania, Huntingdon County, Delayed Birth Records, 1800-1935 - FSI;[Report|18-1799 DgsMisassignments];0;1;0;0;1
2020-08-28 20:53:46;[11-0248|http://rosettaprod-app01.a.fsglobal.net:8081/teamworks/source?project=11-0248];Nebraska, Nebraska State Historical Society, Grand Army of the Republic Records, Burials, 1861-1948 - FSI;[Report|11-0248 DgsMisassignments];0;19;0;0;19
2020-08-28 20:53:47;[11-1337|http://rosettaprod-app01.a.fsglobal.net:8081/teamworks/source?project=11-1337];Germany, Baden, Kenzingen, Church Book Duplicates, 1810-1869 - FSI;[Report|11-1337 DgsMisassignments];0;36;0;0;36
2020-08-28 20:53:48;[18-0690|http://rosettaprod-app01.a.fsglobal.net:8081/teamworks/source?project=18-0690];Ohio, Bloomfield Township, Brownwood Cemetery Records, 1824-2012 - FSI;[Report|18-0690 DgsMisassignments];0;2;0;0;2
2020-08-28 20:53:50;[18-0450|http://rosettaprod-app01.a.fsglobal.net:8081/teamworks/source?project=18-0450];Illinois, Decatur Public Library, WWI Soldiers Card File - Deaths, 1917-1918 - FSI;[Report|18-0450 DgsMisassignments];0;1;0;0;1
2020-08-28 20:53:51;[18-0692|http://rosettaprod-app01.a.fsglobal.net:8081/teamworks/source?project=18-0692];Ohio, Summit County Records Center, Edwin Shaw Sanatorium Records, 1915-1947 - FSI;[Report|18-0692 DgsMisassignments];0;5;0;0;5
2020-08-28 20:53:52;[18-0691|http://rosettaprod-app01.a.fsglobal.net:8081/teamworks/source?project=18-0691];Ohio, Summit County Records Center, Summit County Burial Permits, 1915-1947 - FSI;[Report|18-0691 DgsMisassignments];0;28;0;0;28
2020-08-28 20:53:54;[18-0212|http://rosettaprod-app01.a.fsglobal.net:8081/teamworks/source?project=18-0212];California, Sacramento Cemetery Records, 1900-1959 - FSI;[Report|18-0212 DgsMisassignments];0;45;0;0;45
2020-08-28 20:53:55;[18-0454|http://rosettaprod-app01.a.fsglobal.net:8081/teamworks/source?project=18-0454];Illinois, Decatur Public Library, WWI Soldiers Card File, 1916-1918 - FSI;[Report|18-0454 DgsMisassignments];0;4;0;0;4
2020-08-28 20:53:55;[18-0453|http://rosettaprod-app01.a.fsglobal.net:8081/teamworks/source?project=18-0453];Illinois, Decatur Public Library, WWI Soldiers Card File - Enlistments, 1917-1918 - FSI;[Report|18-0453 DgsMisassignments];0;1;0;0;1
2020-08-28 20:53:56;[18-1300|http://rosettaprod-app01.a.fsglobal.net:8081/teamworks/source?project=18-1300];California, Honor Roll of Californians who served in WWI, 1914-1918 - FSI;[Report|18-1300 DgsMisassignments];0;7;0;0;7
2020-08-28 20:53:59;[18-0456|http://rosettaprod-app01.a.fsglobal.net:8081/teamworks/source?project=18-0456];Illinois, Macon, Decatur Public Library, Decatur Daily Review, Index Lists & Index Card File to Obituaries 1879-2007 - FSI;[Report|18-0456 DgsMisassignments];0;39;0;0;39
2020-05-19 20:20:07;[18-0213|http://rosettaprod-app01.a.fsglobal.net:8081/teamworks/source?project=18-0213];Italy, Avellino, Civil Registration, 1866-1947 (DGA Project) - FSI;[Report|18-0213 DgsMisassignments];0;1084;1;0;1085
2020-06-01 14:53:46;[18-0455|http://rosettaprod-app01.a.fsglobal.net:8081/teamworks/source?project=18-0455];Missouri, Missouri State Archives, Pre-WWII Adjutant General Enlistment Contracts, 1900-1941 - FSI;[Report|18-0455 DgsMisassignments];0;189;254;0;443
2020-08-28 20:54:04;[18-0458|http://rosettaprod-app01.a.fsglobal.net:8081/teamworks/source?project=18-0458];Texas Birth Records, 1916, 1920 - FSI;[Report|18-0458 DgsMisassignments];0;2;0;0;2
2020-05-19 20:20:07;[18-0457|http://rosettaprod-app01.a.fsglobal.net:8081/teamworks/source?project=18-0457];United States, Index to New York Land Records, 1630-1975 (NYGB) - FSI;[Report|18-0457 DgsMisassignments];0;894;0;0;894
2020-08-28 20:54:07;[13-0452|http://rosettaprod-app01.a.fsglobal.net:8081/teamworks/source?project=13-0452];Canadian Border Crossings, 1894-1954 (NARA A3445, A3450, A3451, A3478, A3480) Purchased Images - FSI;[Report|13-0452 DgsMisassignments];0;31;0;0;31
2020-08-28 20:54:09;[11-0279|http://rosettaprod-app01.a.fsglobal.net:8081/teamworks/source?project=11-0279];Portugal, Porto, Catholic Church records-FSI;[Report|11-0279 DgsMisassignments];0;5;0;0;5
2020-08-28 20:54:12;[18-0241|http://rosettaprod-app01.a.fsglobal.net:8081/teamworks/source?project=18-0241];Georgia, Atlanta History Center, Campbell County, Vital Statistics index to births and deaths, 1927-1931 - FSI;[Report|18-0241 DgsMisassignments];0;1;0;0;1
2020-05-19 20:20:07;[18-1572|http://rosettaprod-app01.a.fsglobal.net:8081/teamworks/source?project=18-1572];Rhode Island, World War II Draft Registration Cards,1940-1947 (NARA) - FSI;[Report|18-1572 DgsMisassignments];0;154;0;0;154
2020-08-28 20:54:16;[18-0242|http://rosettaprod-app01.a.fsglobal.net:8081/teamworks/source?project=18-0242];Georgia, Atlanta History Center, Fulton County and De Kalb County, Voters list, 1926 - FSI;[Report|18-0242 DgsMisassignments];0;2;0;0;2
2020-05-19 20:20:07;[18-1334|http://rosettaprod-app01.a.fsglobal.net:8081/teamworks/source?project=18-1334];United States, American Medical Association, Deceased Physicians File, 1864-1970 - FSI;[Report|18-1334 DgsMisassignments];0;102;135;0;237
2020-08-28 20:54:19;[18-0247|http://rosettaprod-app01.a.fsglobal.net:8081/teamworks/source?project=18-0247];Italy, Salerno, Civil Registration, 1809-1946 (DGA Project) - FSI;[Report|18-0247 DgsMisassignments];0;250;0;0;250
2020-05-19 20:20:07;[18-1338|http://rosettaprod-app01.a.fsglobal.net:8081/teamworks/source?project=18-1338];Hawaii, Various Islands, Circuit Court Divorce Records, 1849-1915 (Hawaii ROC ONLY) - DB/FSI;[Report|18-1338 DgsMisassignments];0;2;0;0;2
2020-05-19 20:20:07;[19-1099|http://rosettaprod-app01.a.fsglobal.net:8081/teamworks/source?project=19-1099];Italy, Bologna, Civil Registration, 1806-1899 (DGA Project) - FSI;[Report|19-1099 DgsMisassignments];0;450;0;0;450
2020-05-19 20:20:07;[16-1014|http://rosettaprod-app01.a.fsglobal.net:8081/teamworks/source?project=16-1014];Finland, Kuopio, Tax Lists, 1810-1915 - FSI;[Report|16-1014 DgsMisassignments];0;2;0;0;2
2020-07-16 03:10:00;[20-0835|http://rosettaprod-app01.a.fsglobal.net:8081/teamworks/source?project=20-0835];Papua New Guinea, Birth Records, 1888-2004 - FSI;[Report|20-0835 DgsMisassignments];52;0;0;0;52
2020-07-13 23:28:24;[20-0837|http://rosettaprod-app01.a.fsglobal.net:8081/teamworks/source?project=20-0837];Wisconsin, Wisconsin Vital Records Office, Marriage Records, 1979-1997 (ACOM - 47747) - FSI;[Report|20-0837 DgsMisassignments];0;0;12;12;12
2020-08-28 20:54:23;[18-1321|http://rosettaprod-app01.a.fsglobal.net:8081/teamworks/source?project=18-1321];Utah, World War I Service Questionnaires, 1914-1918 - DB/FSI;[Report|18-1321 DgsMisassignments];0;18;0;0;18
2020-05-19 20:20:07;[18-1320|http://rosettaprod-app01.a.fsglobal.net:8081/teamworks/source?project=18-1320];New York, Index to Passenger Lists of Vessels Arriving at New York City, compiled 1897-1902 (NARA, T519) - FSI;[Report|18-1320 DgsMisassignments];0;24;0;0;24
2020-05-19 20:20:07;[18-1322|http://rosettaprod-app01.a.fsglobal.net:8081/teamworks/source?project=18-1322];South Africa, Civil Marriage Records, 1840-1973 - FSI;[Report|18-1322 DgsMisassignments];0;229;0;0;229
2020-08-28 20:54:27;[13-0448|http://rosettaprod-app01.a.fsglobal.net:8081/teamworks/source?project=13-0448];South Africa, Pietermaritzburg Estate Files 1846-1950 - FSI;[Report|13-0448 DgsMisassignments];0;230;0;0;230
2020-08-28 20:54:29;[18-1567|http://rosettaprod-app01.a.fsglobal.net:8081/teamworks/source?project=18-1567];Louisiana, Confederate Pensions, 1898-1950 - FSI;[Report|18-1567 DgsMisassignments];0;133;0;0;133
2020-08-28 20:54:30;[18-1324|http://rosettaprod-app01.a.fsglobal.net:8081/teamworks/source?project=18-1324];Ohio, Adjutant General's Office, World War I (WWI) Enrollment Cards, 1914-1918 - FSI;[Report|18-1324 DgsMisassignments];0;76;0;0;76
2020-08-28 20:54:32;[19-1086|http://rosettaprod-app01.a.fsglobal.net:8081/teamworks/source?project=19-1086];Florida, Pensacola, Passenger Lists of Citizens (1924–1948) and Aliens (1946-1948) Arriving at Pensacola, Florida, Passenger Lists of Vessels Departing from Pensacola, Florida (1926-1948) - (NARA M2021) - FSI;[Report|19-1086 DgsMisassignments];0;1;0;0;1
2020-08-28 20:54:33;[19-1087|http://rosettaprod-app01.a.fsglobal.net:8081/teamworks/source?project=19-1087];Maryland, Baltimore, Index (Soundex) to passenger lists of vessels arriving at Baltimore, 1897-1952 (NARA T520) - FSI;[Report|19-1087 DgsMisassignments];0;43;0;0;43
2020-05-19 20:20:07;[17-0898|http://rosettaprod-app01.a.fsglobal.net:8081/teamworks/source?project=17-0898];Indiana, County Marriages - Part 5 - Howard County, Part 2, 1906-1957 - FSI/DB;[Report|17-0898 DgsMisassignments];0;121;0;0;121
2020-08-28 20:54:36;[18-1471|http://rosettaprod-app01.a.fsglobal.net:8081/teamworks/source?project=18-1471];Kansas State Census, 1915 - Additional Content - FSI/DB (indexing support);[Report|18-1471 DgsMisassignments];0;1;0;0;1
2020-08-28 20:54:37;[18-0383|http://rosettaprod-app01.a.fsglobal.net:8081/teamworks/source?project=18-0383];Louisiana, Louisiana State Archives, Orleans Parish, Death Records, 1964 - FSI;[Report|18-0383 DgsMisassignments];0;40;0;0;40
2020-08-28 20:54:38;[18-0141|http://rosettaprod-app01.a.fsglobal.net:8081/teamworks/source?project=18-0141];Utah, FamilySearch, Early Church Information File, 1830-1900 - FSI;[Report|18-0141 DgsMisassignments];0;63;0;0;63
2020-05-19 20:20:07;[17-0410|http://rosettaprod-app01.a.fsglobal.net:8081/teamworks/source?project=17-0410];Brazil, Sao Paulo, Civil Registration, 1907-1995, FSI;[Report|17-0410 DgsMisassignments];0;5190;270;0;5460
2020-08-28 20:54:41;[18-0144|http://rosettaprod-app01.a.fsglobal.net:8081/teamworks/source?project=18-0144];Oregon, Benton County, Military Service Discharge Records, 1920-1948, Index 1919-1972 - FSI;[Report|18-0144 DgsMisassignments];0;16;0;0;16
2020-08-28 20:54:43;[17-1742|http://rosettaprod-app01.a.fsglobal.net:8081/teamworks/source?project=17-1742];France, Calvados, Military Registration Cards, 1867-1921 - FSI;[Report|17-1742 DgsMisassignments];0;222;0;0;222
2020-08-28 20:54:44;[18-0385|http://rosettaprod-app01.a.fsglobal.net:8081/teamworks/source?project=18-0385];Canada, Nova Scotia Births, 1864-1877 - FSI;[Report|18-0385 DgsMisassignments];0;4;0;0;4
2020-08-28 20:54:45;[18-0146|http://rosettaprod-app01.a.fsglobal.net:8081/teamworks/source?project=18-0146];New Jersey, Reclaim the Records, New Jersey Death Index, 1901-1903 - FSI;[Report|18-0146 DgsMisassignments];0;3;0;0;3
2020-08-28 20:54:47;[18-0388|http://rosettaprod-app01.a.fsglobal.net:8081/teamworks/source?project=18-0388];Honduras, Catholic Church Records, 1694-1979, Part 2 - FSI;[Report|18-0388 DgsMisassignments];0;85;0;0;85
2020-05-19 20:20:07;[13-0740|http://rosettaprod-app01.a.fsglobal.net:8081/teamworks/source?project=13-0740];South Africa, Netherdutch Reformed Church of Africa, Christening and Membership Records, 1838-1991 - FSI;[Report|13-0740 DgsMisassignments];0;44;0;0;44
2020-08-28 20:54:49;[17-0647|http://rosettaprod-app01.a.fsglobal.net:8081/teamworks/source?project=17-0647];Spain, Province of Gerona, Municipal Civil Registration, 1836-1870 - FSI;[Report|17-0647 DgsMisassignments];0;6;0;0;6
2020-08-28 20:54:50;[17-0406|http://rosettaprod-app01.a.fsglobal.net:8081/teamworks/source?project=17-0406];Montana, Flathead County Records, Deaths 1897-2007 - FSI;[Report|17-0406 DgsMisassignments];0;35;0;0;35
2020-08-28 20:54:50;[18-0131|http://rosettaprod-app01.a.fsglobal.net:8081/teamworks/source?project=18-0131];Tennessee, Deaths, 1964-1966 - FSI;[Report|18-0131 DgsMisassignments];0;67;0;0;67
2020-08-28 20:54:51;[18-0373|http://rosettaprod-app01.a.fsglobal.net:8081/teamworks/source?project=18-0373];France, Vienne, Census, 1876 - FSI;[Report|18-0373 DgsMisassignments];0;95;0;0;95
2020-08-28 20:54:53;[18-0375|http://rosettaprod-app01.a.fsglobal.net:8081/teamworks/source?project=18-0375];Australia, South Australia, School Admission Registers, 1873-1985 - FSI;[Report|18-0375 DgsMisassignments];0;444;0;0;444
2020-08-28 20:54:54;[18-0133|http://rosettaprod-app01.a.fsglobal.net:8081/teamworks/source?project=18-0133];Iowa, Old Age Assistance Records, Ringgold County, 1936-1958 - FSI;[Report|18-0133 DgsMisassignments];0;28;0;0;28
2020-05-19 20:20:07;[16-0944|http://rosettaprod-app01.a.fsglobal.net:8081/teamworks/source?project=16-0944];United States, State and County Mixed Vital Records, 1635-2003 - FSI (Multicollection) - Part 3 (FMP);[Report|16-0944 DgsMisassignments];0;0;2;0;2
2020-08-28 20:54:58;[18-0374|http://rosettaprod-app01.a.fsglobal.net:8081/teamworks/source?project=18-0374];France, Vienne, Census, 1896 - FSI;[Report|18-0374 DgsMisassignments];0;95;0;0;95
2020-08-28 20:55:00;[18-0135|http://rosettaprod-app01.a.fsglobal.net:8081/teamworks/source?project=18-0135];Minnesota County Death Records, 1850-2001 - FSI;[Report|18-0135 DgsMisassignments];0;259;0;0;259
2020-08-28 20:55:01;[18-1466|http://rosettaprod-app01.a.fsglobal.net:8081/teamworks/source?project=18-1466];Hawaii, World War I Service Records, 1917-1919 (Hawaii ROC) - FSI;[Report|18-1466 DgsMisassignments];0;9;0;0;9
2020-06-25 18:36:43;[18-1465|http://rosettaprod-app01.a.fsglobal.net:8081/teamworks/source?project=18-1465];Oklahoma, Confederate Pension Applications, 1879-1920 - FSI;[Report|18-1465 DgsMisassignments];0;21;0;0;21
2020-08-28 20:55:03;[19-1083|http://rosettaprod-app01.a.fsglobal.net:8081/teamworks/source?project=19-1083];Louisiana, New Orleans, Index to Passenger Lists, 1853-1952 (NARA T527, NARA T618) - FSI;[Report|19-1083 DgsMisassignments];0;54;0;0;54
2020-07-08 18:39:39;[20-0093|http://rosettaprod-app01.a.fsglobal.net:8081/teamworks/source?project=20-0093];England, Middlesex Parish Registers, 1539-1988 - FSI;[Report|20-0093 DgsMisassignments];3;0;0;0;3
2020-08-28 20:55:04;[18-1468|http://rosettaprod-app01.a.fsglobal.net:8081/teamworks/source?project=18-1468];Hawaii, Harbin File - Russian Immigrant Laborers Index A-Z, 1909-1910 (Hawaii ROC) - FSI;[Report|18-1468 DgsMisassignments];0;1;0;0;1
2020-08-28 20:55:05;[18-0136|http://rosettaprod-app01.a.fsglobal.net:8081/teamworks/source?project=18-0136];Nebraska, Box Butte County, Funeral Home Records, 1919-1976 - FSI;[Report|18-0136 DgsMisassignments];0;20;0;0;20
2020-05-19 20:20:07;[18-1467|http://rosettaprod-app01.a.fsglobal.net:8081/teamworks/source?project=18-1467];United States 1880 Census - Missouri Missing Pages - 3rd Party Image Ingest / FSI / DB;[Report|18-1467 DgsMisassignments];0;1;0;0;1
2020-08-28 20:55:07;[09-0124|http://rosettaprod-app01.a.fsglobal.net:8081/teamworks/source?project=09-0124];Germany, Westfalen, Minden - Census - FSI;[Report|09-0124 DgsMisassignments];0;1;1;0;2
2020-08-28 20:55:10;[17-1721|http://rosettaprod-app01.a.fsglobal.net:8081/teamworks/source?project=17-1721];United States, District of Columbia, Glenwood Cemetery, Burial and Interment Records, 1878-2013 - FSI;[Report|17-1721 DgsMisassignments];0;30;0;0;30
2020-08-28 20:55:11;[18-1011|http://rosettaprod-app01.a.fsglobal.net:8081/teamworks/source?project=18-1011];North Carolina, Historical Records Survey Cemetery Inscription Card Index, ca. 1800-1972 - FSI;[Report|18-1011 DgsMisassignments];0;26;0;0;26
2020-08-28 20:55:12;[14-0694|http://rosettaprod-app01.a.fsglobal.net:8081/teamworks/source?project=14-0694];American Samoa, Census Records, 1900-1945 (NARA) - FSI;[Report|14-0694 DgsMisassignments];0;4;0;0;4
2020-08-28 20:55:14;[18-1010|http://rosettaprod-app01.a.fsglobal.net:8081/teamworks/source?project=18-1010];Virginia, Virginia Historical Society, Jewish Cemetery Records Index, 1800-1986 - FSI;[Report|18-1010 DgsMisassignments];0;15;0;0;15
2020-08-28 20:55:15;[17-0872|http://rosettaprod-app01.a.fsglobal.net:8081/teamworks/source?project=17-0872];New York, Reclaim the Records, New York State Death Index, 1880-1956 - FSI;[Report|17-0872 DgsMisassignments];0;77;0;0;77
2020-08-28 20:55:17;[18-0166|http://rosettaprod-app01.a.fsglobal.net:8081/teamworks/source?project=18-0166];Connecticut, Vital Records, Prior to 1850 - FSI;[Report|18-0166 DgsMisassignments];0;49;0;0;49
2020-08-28 20:55:18;[17-1720|http://rosettaprod-app01.a.fsglobal.net:8081/teamworks/source?project=17-1720];Hawaii, Land Grantor and Grantee Index, 1845-1909 - FSI;[Report|17-1720 DgsMisassignments];0;48;0;0;48
2020-05-19 20:20:07;[14-1781|http://rosettaprod-app01.a.fsglobal.net:8081/teamworks/source?project=14-1781];Switzerland, Fribourg, Census, 1880 (German Content) - FSI;[Report|14-1781 DgsMisassignments];0;5;17;0;22
2020-08-28 20:55:22;[18-0168|http://rosettaprod-app01.a.fsglobal.net:8081/teamworks/source?project=18-0168];New Jersey, Reclaim the Records, New Jersey Bride Index, 1930-1938 - FSI;[Report|18-0168 DgsMisassignments];0;6;0;0;6
2020-05-19 20:20:07;[18-1017|http://rosettaprod-app01.a.fsglobal.net:8081/teamworks/source?project=18-1017];Chile, Cemetery Records, 1800-2015 - FSI/DB for FSI Support;[Report|18-1017 DgsMisassignments];0;1192;28;0;1220
2020-08-28 20:55:24;[18-1258|http://rosettaprod-app01.a.fsglobal.net:8081/teamworks/source?project=18-1258];South Africa, KwaZulu Natal, Passenger Lists, 1860-1911 - FSI;[Report|18-1258 DgsMisassignments];0;90;0;0;90
2020-08-28 20:55:25;[18-1019|http://rosettaprod-app01.a.fsglobal.net:8081/teamworks/source?project=18-1019];Ohio, Marietta, Cemetery Records, 1788-2013 - FSI;[Report|18-1019 DgsMisassignments];0;4;0;0;4
2020-05-19 20:20:07;[12-1097|http://rosettaprod-app01.a.fsglobal.net:8081/teamworks/source?project=12-1097];Poland, Radom Roman Catholic Diocese Church Books, 1733-1868, pt. 5 - FSI;[Report|12-1097 DgsMisassignments];0;3;0;0;3
2020-08-28 20:55:28;[17-1715|http://rosettaprod-app01.a.fsglobal.net:8081/teamworks/source?project=17-1715];Hawaii, Kauai County, Obituaries, 1982-2010 - FSI;[Report|17-1715 DgsMisassignments];0;7;0;0;7
2020-08-28 20:55:29;[17-0869|http://rosettaprod-app01.a.fsglobal.net:8081/teamworks/source?project=17-0869];South Carolina, Chesterfield County, Original Marriage licenses, 1911-1951 - FSI;[Report|17-0869 DgsMisassignments];0;54;0;0;54
2020-08-28 20:55:30;[17-1717|http://rosettaprod-app01.a.fsglobal.net:8081/teamworks/source?project=17-1717];Zimbabwe, Death Registers, 1890-1977 - FSI;[Report|17-1717 DgsMisassignments];0;95;0;0;95
2020-08-28 20:55:31;[14-0227|http://rosettaprod-app01.a.fsglobal.net:8081/teamworks/source?project=14-0227];Netherlands, Noord-Holland, Amsterdam, Civil Registration - Births - FSI;[Report|14-0227 DgsMisassignments];0;14;0;0;14
2020-08-28 20:55:32;[17-1716|http://rosettaprod-app01.a.fsglobal.net:8081/teamworks/source?project=17-1716];Texas, Houston, Historic Hollywood Cemetery, Burial and Disinterment Applications, 1895-2007 - FSI;[Report|17-1716 DgsMisassignments];0;79;0;0;79
2020-08-28 20:55:34;[18-0390|http://rosettaprod-app01.a.fsglobal.net:8081/teamworks/source?project=18-0390];Louisiana, Louisiana State Archives, Births, 1914 - FSI;[Report|18-0390 DgsMisassignments];0;23;0;0;23
2020-08-28 20:55:36;[18-0393|http://rosettaprod-app01.a.fsglobal.net:8081/teamworks/source?project=18-0393];Virginia, Lynchburg Diuguid Funeral Home records, 1820-1966 - FSI;[Report|18-0393 DgsMisassignments];0;29;0;0;29
2020-08-28 20:55:39;[18-0151|http://rosettaprod-app01.a.fsglobal.net:8081/teamworks/source?project=18-0151];Oregon, Yamill County, Military Service Discharge Records, 1919-1951, Index 1920-2008 - FSI;[Report|18-0151 DgsMisassignments];0;24;0;0;24
2020-08-28 20:55:42;[18-0392|http://rosettaprod-app01.a.fsglobal.net:8081/teamworks/source?project=18-0392];Kentucky, World War II Draft Registration Cards, 1940-1945 (NARA) - FSI;[Report|18-0392 DgsMisassignments];0;721;0;0;721
2020-08-28 20:55:43;[18-1242|http://rosettaprod-app01.a.fsglobal.net:8081/teamworks/source?project=18-1242];Louisiana, Ascension Parish, Index of Marriages, 1773-1963 - FSI;[Report|18-1242 DgsMisassignments];0;1;0;0;1
2020-08-28 20:55:45;[14-1793|http://rosettaprod-app01.a.fsglobal.net:8081/teamworks/source?project=14-1793];England, Surrey Parish Registers, 1538-1970 - FSI;[Report|14-1793 DgsMisassignments];0;90;0;0;90
2020-08-28 20:55:48;[18-0153|http://rosettaprod-app01.a.fsglobal.net:8081/teamworks/source?project=18-0153];New Jersey, Reclaim the Records, New Jersey Birth Index, 1901-1903 - FSI;[Report|18-0153 DgsMisassignments];0;9;0;0;9
2020-08-28 20:55:49;[18-0395|http://rosettaprod-app01.a.fsglobal.net:8081/teamworks/source?project=18-0395];Australia, South Australia, Wills and Probates, 1844-1916 - FSI;[Report|18-0395 DgsMisassignments];0;218;0;0;218
2020-05-19 20:20:07;[18-0394|http://rosettaprod-app01.a.fsglobal.net:8081/teamworks/source?project=18-0394];Wisconsin, Wisconsin Vital Records Office, Reprocessed Birth Records, 1948-1977 - (Ancestry 47786) - FSI;[Report|18-0394 DgsMisassignments];0;38;0;0;38
2020-08-28 20:55:54;[18-0152|http://rosettaprod-app01.a.fsglobal.net:8081/teamworks/source?project=18-0152];Oregon, Baker County, Military Service Discharge Records, 1945-1950 - FSI;[Report|18-0152 DgsMisassignments];0;3;0;0;3
2020-08-28 20:55:56;[18-1241|http://rosettaprod-app01.a.fsglobal.net:8081/teamworks/source?project=18-1241];Dummy Traveler for BLOCKING TRAINING purposes (English);[Report|18-1241 DgsMisassignments];0;0;498;0;498
2020-08-28 20:55:57;[18-1243|http://rosettaprod-app01.a.fsglobal.net:8081/teamworks/source?project=18-1243];United States, WWI, Recruits for the Polish Army in France, 1917-1919 - FSI;[Report|18-1243 DgsMisassignments];0;11;0;0;11
2020-05-19 20:20:07;[18-1488|http://rosettaprod-app01.a.fsglobal.net:8081/teamworks/source?project=18-1488];United States, Enlisted and Officer Muster Rolls and Rosters, 1916-1939 (NARA 85713803) - Capture/FSI;[Report|18-1488 DgsMisassignments];0;88;12;1;100
2020-05-19 20:20:07;[18-1246|http://rosettaprod-app01.a.fsglobal.net:8081/teamworks/source?project=18-1246];Peru, Iquitos, Cemetery Records, 1912-2013 - FSI;[Report|18-1246 DgsMisassignments];0;3;14;0;17
2020-08-28 20:56:02;[18-1245|http://rosettaprod-app01.a.fsglobal.net:8081/teamworks/source?project=18-1245];Texas, Gonzales County, Birth Records, 1878-1945 - FSI;[Report|18-1245 DgsMisassignments];0;22;0;0;22
2020-08-28 20:56:03;[20-0076|http://rosettaprod-app01.a.fsglobal.net:8081/teamworks/source?project=20-0076];Texas, Dallas County, Oakland Cemetery Interment Cards, 1891-1999 - FSI;[Report|20-0076 DgsMisassignments];0;4;0;0;4
2020-08-28 20:56:05;[09-0140|http://rosettaprod-app01.a.fsglobal.net:8081/teamworks/source?project=09-0140];Belgium - Civil Registration 1851-1900 - Indexing - Part 2;[Report|09-0140 DgsMisassignments];0;77;0;0;77
2020-05-19 20:20:07;[19-0198|http://rosettaprod-app01.a.fsglobal.net:8081/teamworks/source?project=19-0198];Indiana, County Marriages, 1811-2007 - FSI;[Report|19-0198 DgsMisassignments];0;267;22;0;289
2020-05-19 19:14:11;[19-1285|http://rosettaprod-app01.a.fsglobal.net:8081/teamworks/source?project=19-1285];Washington, County Death Registers, 1881-1922 - FSI;[Report|19-1285 DgsMisassignments];9;0;40;0;49
2020-08-28 20:56:10;[19-1283|http://rosettaprod-app01.a.fsglobal.net:8081/teamworks/source?project=19-1283];Washington, County Birth Registers, 1873-1965 - FSI;[Report|19-1283 DgsMisassignments];0;3;1;0;4
2020-08-28 20:56:11;[18-0191|http://rosettaprod-app01.a.fsglobal.net:8081/teamworks/source?project=18-0191];Montana, Toole County Naturalization Card & Document Indexes, 1913-1956 - FSI;[Report|18-0191 DgsMisassignments];0;1;0;0;1
2020-08-28 20:56:13;[19-1048|http://rosettaprod-app01.a.fsglobal.net:8081/teamworks/source?project=19-1048];Georgia, Savannah, Passenger Lists, 1906-1945 (NARA T943) - FSI;[Report|19-1048 DgsMisassignments];0;4;0;0;4
2020-08-28 20:56:14;[19-1049|http://rosettaprod-app01.a.fsglobal.net:8081/teamworks/source?project=19-1049];Texas, Passenger Lists of Vessels Arriving at Galveston, Texas, 1896-1951 (NARA M1357, M1358, M1359) - FSI;[Report|19-1049 DgsMisassignments];0;12;0;0;12
2020-05-19 20:20:07;[18-1273|http://rosettaprod-app01.a.fsglobal.net:8081/teamworks/source?project=18-1273];England, Shropshire Parish Registers, 1538-1918 - FSI;[Report|18-1273 DgsMisassignments];0;115;0;0;115
2020-08-28 20:56:17;[17-0694|http://rosettaprod-app01.a.fsglobal.net:8081/teamworks/source?project=17-0694];Virginia, Fluvanna County, Colbert Funeral Home Records, 1929-1976 - FSI;[Report|17-0694 DgsMisassignments];0;12;0;0;12
2020-08-28 20:56:18;[18-1274|http://rosettaprod-app01.a.fsglobal.net:8081/teamworks/source?project=18-1274];Montana, Manifests of Alien Arrivals at Various Locations, 1917-1956 (NARA) - FSI;[Report|18-1274 DgsMisassignments];0;73;0;0;73
